Alamosa County Chamber of Commerce ,U.S. Chamber Member,www.alamosachamber.com,(719)589-3681, 610 State Ave," Alamosa, CO 81101 ",
Aurora Chamber of Commerce ,U.S. Chamber Member,www.aurorachamber.org,(303)344-1500," 14305 East Alameda Ave, Suite 300 "," Aurora, CO 80012 ",
Castle Rock Chamber of Commerce ,U.S. Chamber Member,www.castlerock.org,(303)688-4597, 420 Jerry St," Castle Rock, CO 80104 ",3 / 5
Colorado Chamber of Commerce ,U.S. Chamber Member,www.cochamber.com/,(303)866-9601," 1600 Broadway, Suite 1000 "," Denver, CO 80202 ",
Colorado Springs Chamber & EDC ,U.S. Chamber Member,www.cscedc.com,(719)471-8183," 102 South Tejon St, Suite 430 "," Colorado Springs, CO 80903 ",
Craig Chamber of Commerce ,U.S. Chamber Member,www.craig-chamber.com,(970)824-5689, 360 East Victory Way," Craig, CO 81625 ",
Denver Metro Chamber of Commerce ,U.S. Chamber Member,www.denverchamber.org,(303)620-8091," 1445 Market St, Ste 400 "," Denver, CO 80202 ",
Durango Area Chamber of Commerce ,U.S. Chamber Member,www.durangobusiness.org,(970)247-0312," 1199 Main Ave, Ste 217 "," Durango, CO 81301 ",
Fort Collins Area Chamber of Commerce ,U.S. Chamber Member,www.fortcollinschamber.com,(970)482-3746, 225 South Meldrum St," Fort Collins, CO 80521 ",5 / 5
Fruita Area Chamber of Commerce ,U.S. Chamber Member,www.fruitachamber.org,(970)858-3894, 432 E Aspen Ave," Fruita, CO 81521 ",
Glenwood Springs Chamber Resort Association ,U.S. Chamber Member,www.glenwoodchamber.com,(970)945-0784, 802 Grand Ave," Glenwood Springs, CO 81601 ",
Golden Chamber of Commerce ,U.S. Chamber Member,www.goldenchamber.org,(303)279-3113, 1010 Washington Ave.," Golden, CO 80401 ",
Grand Junction Chamber of Commerce ,U.S. Chamber Member,www.gjchamber.org,(970)242-3214, 360 Grand Ave," Grand Junction, CO 81501 ",
Greater Pueblo Chamber of Commerce ,U.S. Chamber Member,www.pueblochamber.org,(719)542-1704, 302 North Santa Fe Ave," Pueblo, CO 81003 ",
Greeley Chamber of Commerce ,U.S. Chamber Member,www.greeleychamber.com,(970)352-3566, 902 7th Ave," Greeley, CO 80631 ",
Logan County Chamber Of Commerce ,U.S. Chamber Member,www.logancountychamber.com,(970)522-5070, 109 N Front St.," Sterling, CO 80751 ",
Loveland Chamber of Commerce ,U.S. Chamber Member,www.loveland.org/,(970)744-4791, 5400 Stone Creek Cir," Loveland, CO 80538 ",
Parker Area Chamber of Commerce ,U.S. Chamber Member,parkerchamber.com,(303)841-4268," 19590 East Main St, Suite 100 "," Parker, CO 80138 ",
Rifle Area Chamber of Commerce ,U.S. Chamber Member,www.riflechamber.com,(970)625-2085, 100 E 11th St," Rifle, CO 81650 ",
South Metro Denver Chamber of Commerce ,U.S. Chamber Member,www.bestchamber.com,(303)795-0142," 6972 S Vine St, Ste 363 "," Centennial, CO 80122 ",
Steamboat Springs Chamber Resort Association ,U.S. Chamber Member,www.steamboat-chamber.com,(970)875-70070880, 125 Anglers Dr," Steamboat Springs, CO 80487 ",
Summit Chamber of Commerce ,U.S. Chamber Member,www.summitchamber.org,(970)668-2051, PO Box 5450," Frisco, CO 80443 ",
The Chamber of Northwest Douglas County ,U.S. Chamber Member,www.highlandsranchchamber.org,(303)791-3500," 300 West Plaza Dr, Suite 225 "," Highlands Ranch, CO 80129 ",
Vail Valley Partnership ,U.S. Chamber Member,www.vailvalleypartnership.com,(970)476-1000," 97 Main St, Suite E20 "," Edwards, CO 81632 ",
Westminster Chamber Of Commerce ,U.S. Chamber Member,westminsterchamber.biz,(303)961-5975, PO Box 1453," Westminster, CO 80031 ",
Holyoke Chamber of Commerce ,,www.holyokechamber.org,(970)854-3517, Po Box 134," Holyoke, CO 80734 ",
Arvada Chamber of Commerce ,,www.arvadachamber.org,(303)424-0313, 7305 Grandview Ave," Arvada, CO 80002 ",
Aspen Chamber Resort Association ,,www.aspenchamber.org,(970)925-1940, 590 N Mill St," Aspen, CO 81611 ",
Bayfield Area Chamber of Commerce ,,www.bayfieldchamber.org,(715)779-3335, PO Box 7," Bayfield, CO 81122 ",
Boulder Chamber of Commerce ,,www.boulderchamber.com/,(303)442-1044, 2440 Pearl St," Boulder, CO 80302 ",
Brighton Chamber of Commerce ,,www.brightonchamber.com,(303)659-0223," 22 South 4th Ave, Suite 205 "," Brighton, CO 80601 ",
Broomfield Chamber of Commerce ,,www.access.broomfieldchamber.com,(303)464-1775," 105 Edgeview Dr, Suite 410 "," Broomfield, CO 80021 ",5 / 5
Canon City Chamber of Commerce ,,www.canoncitychamber.com,(719)275-2331, 403 Royal Gorge Blvd," Canon City, CO 81212 ",
Carbon Valley Chamber of Commerce ,,www.carbonvalleychamber.com,(303)833-5933," 8303 Colorado Blvd, Suite 203 "," Firestone, CO 80504 ",
Carbondale Chamber of Commerce ,,www.carbondale.com,(970)963-1890, PO Box 1645," Carbondale, CO 81623 ",
Cedaredge Area Chamber of Commerce ,,www.cedaredgechamber.com,(970)856-6961, 245 West Main St," Cedaredge, CO 81413 ",
Cherry Creek Chamber of Commerce ,,cherrycreekchamber.org,(303)388-6022," 100 Fillmore St, Suite 522 "," Denver, CO 80206 ",
Colorado Women's Chamber of Commerce ,,www.cwcc.org,(303)458-0220," 1350 17th St, Suite 100 "," Denver, CO 80202 ",
Crested Butte/Mt. Crested Butte Chamber of Commerc ,,www.cbchamber.com,(970)349-6438, 601 Elk Ave," Crested Butte, CO 81224 ",
Delta Area Chamber of Commerce ,,www.deltacolorado.org,(970)874-8616, 301 Main St.," Delta, CO 81416 ",
Englewood Chamber of Commerce ,,www.myenglewoodchamber.com,(303)789-4473," 3501 South Broadway, 2nd Floor "," Englewood, CO 80113 ",
Evans Chamber of Commerce ,,www.evanschamberofcommerce.org,(970)330-4204," 3819 Saint Vrain St, Ste C "," Evans, CO 80620 ",
Florence Chamber of Commerce ,,www.finditinflorence.com,(719)784-3544, PO Box 145," Florence, CO 81226 ",
Granby Chamber of Commerce ,,granbychamber.com,(970)887-2311, PO Box 35," Granby, CO 80446 ",
Grand Lake Area Chamber of Commerce ,,www.grandlakechamber.com/,(970)627-3402, PO Box 429," Grand Lake, CO 80447 ",
Greater Glendale Chamber of Commerce ,,www.ggchamber.com,(303)584-4180, 950 South Birch St," Glendale, CO 80246 ",
Greater Woodland Park Chamber of Commerce ,,www.woodlandparkchamber.com,(719)687-9885, 210 E Midland Avenue," Woodland Park, CO 80863 ",
Greenhorn Valley Chamber of Commerce ,,www.greenhornchamber.org/about.html,(719)676-3000, 4497 Bent Brothers Blvd," Colorado City, CO 81019 ",
Greenwood Village Chamber of Commerce ,,www.dtcchamber.com,(303)290-9922," 7600 Landmark Way, Suite 1615 "," Greenwood Village, CO 80111 ",
Kremmling Area Chamber of Commerce ,,www.kremmlingchamber.com,(970)724-3472, PO Box 471," Kremmling, CO 80459 ",
La Junta Chamber of Commerce ,,www.lajuntachamber.com,(719)384-7411, 110 Santa Fe Ave," La Junta, CO 81050 ",
Leadville/Lake County Chamber of Commerce ,,www.leadvilleusa.com,(719)486-3900, 809 Harrison Ave," Leadville, CO 80461 ",
Longmont Area Chamber of Commerce ,,www.longmontchamber.org,(303)776-5295, 528 Main St," Longmont, CO 80501 ",
Mancos Valley Chamber of Commerce ,,www.mancosvalley.com,(970)533-7434, PO Box 494," Mancos, CO 81328 ",
Manitou Springs Chamber of Commerce ,,www.manitousprings.org,(719)685-5089, 354 Manitou Ave," Manitou Springs, CO 80829 ",
Montrose Chamber of Commerce ,,www.montrosechamber.com/,(970)249-5000," 1519 E Main St, Unit A "," Montrose, CO 81401 ",
Pagosa Springs Chamber of Commerce ,,www.pagosaspringschamber.com,(970)264-2360, PO Box 787," Pagosa Springs, CO 81147 ",
The West Metro Chamber ,,www.westchamber.org,(720)399-5651," 1667 Cole Boulevard, Suite 400, Building #19 "," Golden, CO 80401 ",
Trinidad-Las Animas County Chamber of Commerce ,,www.trinidadco.com,(719)846-9285, 136 West Main St.," Trinidad, CO 81082 ",
Akron Chamber of Commerce ,,www.co.washington.co.us,(970)345-2624, PO Box 233," Akron, CO 80720 ",
Basalt Chamber of Commerce ,,www.basaltchamber.com,(970)927-4031, PO Box 514," Basalt, CO 81621 ",
Berthoud Area Chamber of Commerce ,,www.berthoudcolorado.com,(970)532-4200, PO Box 1709," Berthoud, CO 80513 ",
Breckenridge ResortChamber of Commerce ,,www.gobreck.com,(970)453-2913, PO Box 1909," Breckenridge, CO 80424 ",
Brush Area Chamber of Commerce ,,www.brushchamber.org,(970)842-2666, 218 Clayton St," Brush, CO 80723 ",
Buena Vista Area Chamber of Commerce ,,www.buenavistacolorado.org,(719)395-6612, PO Box 2021," Buena Vista, CO 81211 ",
Burlington Chamber of Commerce ,,,(719)346-8070," 415 15th St., P.O. Box 366 "," Burlington, CO 80807 ",
Conifer Area Chamber of Commerce ,,www.goconifer.com,(303)838-5711," 25997 Conifer Rd, 2nd Floor "," Conifer, CO 80433 ",
Conifer Chamber of Commerce ,,www.coniferchamber.com,(303)838-0178, PO Box 127," Conifer, CO 80433 ",
Cortez Area Chamberof Commerce ,,www.cortezchamber.org,(970)565-3414, 31 W Main St," Cortez, CO 81321 ",
Costilla County Chamber of Commerce ,,www.slvguide.com/COSTILLA/CONTACTUS.HTML,(719)379-3512, PO Box 428," Fort Garland, CO 81133 ",
Crawford Area Chamber of Commerce ,,www.crawfordcountry.org,, PO Box 22," Crawford, CO 81415 ",
Creede-Mineral County Chamber of Commerce ,,www.creede.com,(719)658-2374, 904 S Main," Creede, CO 81130 ",
Crowley County Chamber of Commerce ,,,(719)267-3134, 301 Main St.," Ordway, CO 81063 ",
Custer County Chamber of Commerce ,,www.custercountyco.com,(719)783-9163," 101 N 3rd St., P.O. Box 81 "," Westcliffe, CO 81252 ",
Del Norte Chamber of Commerce ,,www.delnortechamber.org,(719)657-9081, 505 Grand Ave," Del Norte, CO 81132 ",
Divide Chamber of Commerce ,,www.dividechamber.org,(719)687-7670, PO Box 101," Divide, CO 80814 ",
Dolores Chamber of Commerce ,,www.doloreschamber.com,(970)882-4018, PO Box 602," Dolores, CO 81323 ",
Dove Creek Chamber of Commerce ,,,(970)560-2856, PO Box 851," Dove Creek, CO 81324 ",
Elizabeth Area Chamber of Commerce ,,,(303)646-4287, 166 Main St," Elizabeth, CO 80107 ",
Erie Chamber of Commerce ,,www.eriechamber.org,(303)828-3440, PO Box 97," Erie, CO 80516 ",
Estes Park Chamber Resort Association ,,www.estesparkresort.com,(970)586-4431, 500 Big Thompson Ave.," Estes Park, CO 80517 ",
Fort Lupton Chamber of Commerce ,,www.fortluptonchamber.org,(303)857-4474, 1200 Dexter Street #W12," Fort Lupton, CO 80621 ",
Fort Morgan Area Chamber of Commerce ,,www.fortmorganchamber.org,(970)867-6702, 300 Main St.," Fort Morgan, CO 80701 ",
Fountain Valley Chamber of Commerce ,,www.ci.fountain.co.us/chamber,(719)382-3190, PO Box 201," Fountain, CO 80817 ",
Fowler Chamber of Commerce ,,,(719)263-4261," First Natl Bank, P.O. Box 158 "," Fowler, CO 81039 ",
Georgetown Promotions Committee ,,,(303)569-2888, PO Box 444," Georgetown, CO 80444 ",
Gunnison Country Chamber of Commerce ,,gunnisonchamber.com,(970)641-1501, 500 E Tomichi," Gunnison, CO 81230 ",
Haxtun Chamber of Commerce ,,,(970)467-0194," 145 South Colorado Ave, P.O. Box 535 "," Haxtun, CO 80731 ",
Hispanic Chamber of Commerce of Metro Denver ,,www.hispanicchamberdenver.com/,(303)534-7783," 924 W Colfax, Suite 201 "," Denver, CO 80204 ",
Hotchkiss Chamber of Commerce ,,,(970)872-3226, PO Box 158," Hotchkiss, CO 81419 ",
Huerfano County Chamber of Commerce ,,,(719)738-1065, 400 Main St.," Walsenburg, CO 81089 ",
I-70 Corridor Chamber of Commerce ,,www.i70ccoc.com,(303)644-4607, PO Box 386," Strasburg, CO 80136 ",
Idaho Springs Chamber of Commerce ,,,(303)567-0387, PO Box 97," Idaho Springs, CO 80452 ",
Johnstown-Milliken Chamber of Commerce ,,www.johnstownmillikenchamber.com,(970)587-7042, PO Box 501," Johnstown, CO 80534 ",
La Veta/cuchara Chamber of Commerce ,,www.lavetacucharachamber.com,(719)742-3676, PO Box 32," La Veta, CO 81055 ",
Lafayette Chamber of Commerce ,,www.lafayettecolorado.com,(303)666-9555, 1290 S Public Rd.," Lafayette, CO 80026 ",
Lake City/Hinsdale County Chamber of Commerce ,,www.lakecityco.com,(970)944-2527, 800 N Gunnison Ave.," Lake City, CO 81235 ",
Lamar Chamber of Commerce ,,www.lamarchamber.com,(719)336-4379, 109a E Beech," Lamar, CO 81052 ",
Las Animas-Bent County Chamber of Commerce ,,www.labcchamber.com,(719)456-0453, 702 Grove Ave," Las Animas, CO 81054 ",
Limon Chamber of Commerce ,,www.limonchamber.com,(719)775-9418, PO Box 101," Limon, CO 80828 ",
Louisville Chamber of Commerce ,,www.louisvillechamber.com,(303)666-5747, 901 Main St.," Louisville, CO 80027 ",
Loveland Info Chamber of Commerce ,,,(970)744-4792, 5400 Stone Creek Cir," Loveland, CO 80538 ",
Lyons Chamber of Commerce ,,,(303)823-5215," 4th And Broadway, P.O. Box 426 "," Lyons, CO 80540 ",
Meeker Chamber of Commerce ,,www.meekerchamber.com,(970)878-5510, PO Box 869," Meeker, CO 81641 ",
Nederland Area Chamber of Commerce ,,www.nederlandchamber.org,(303)258-3936, PO Box 635," Nederland, CO 80466 ",
New Castle Area Chamber of Commerce ,,,(970)984-2897, PO Box 983," New Castle, CO 81647 ",
North Park Chamber of Commerce ,,northparkchamber.wordpress.com/?fbclid=IwAR3P_LKwi3MY2Whas-XJl2TIMfQFt7lZac2za-mY1LXq6OVoF2gsM1ZXor4,(970)723-4600," 467 Main St, P.O. Box 68 "," Walden, CO 80480 ",
Norwood Chamber of Commerce of Wright's Mesa ,,,(970)327-4833, PO Box 116," Norwood, CO 81423 ",
Nucla-Naturita AreaChamber of Commerce ,,,(970)865-2350, 230 W Main St," Naturita, CO 81422 ",
Palisade Chamber ofCommerce ,,"palisadecoc.com,palisadepeachfest.com",(970)464-7458," 305 S Main St, Suite 102 "," Palisade, CO 81526 ",
Paonia Chamber of Commerce ,,www.paoniachamber.com,(970)527-3886, PO Box 366," Paonia, CO 81428 ",
Penrose Chamber of Commerce ,,www.penrosechamber.com,(719)372-3994, PO Box 379," Penrose, CO 81240 ",
Plateau Valley Chamber of Commerce ,,www.plateauvalley.com,(970)487-3180, PO Box 143," Collbran, CO 81624 ",
Platte Canyon Area Chamber of Commerce ,,www.baileycolorado.org,(303)816-3500, PO Box 477," Bailey, CO 80421 ",
Platteville Chamberof Commerce ,,,(970)785-2903, PO Box 606," Platteville, CO 80651 ",
Rangely Area Chamber of Commerce ,,,(970)675-5290," 255 E Main St., Suite A "," Rangely, CO 81648 ",
Ridgway Area Chamber of Commerce ,,www.ridgwaycolorado.com,(970)626-5181, 150 Racecourse Road," Ridgway, CO 81432 ",
Rocky Ford Chamber of Commerce ,,,(719)254-7483, 105 N Main St.," Rocky Ford, CO 81067 ",
Salida Chamber of Commerce ,,salidachamber.org,(719)539-2068, 406 W Hwy. 50," Salida, CO 81201 ",
Sedgwick County Chamber of Commerce ,,,(970)474-3504, 114 E First," Julesburg, CO 80737 ",
Silt Area Chamber of Commerce ,,,(970)876-1999, PO Box 921," Silt, CO 81652 ",
South Fork Chamber of Commerce ,,www.southfork.org,(719)873-1639, 29886 Hwy 160," South Fork, CO 81154 ",
South Park Chamber of Commerce ,,southparkchamber.com,(720)205-0178, PO Box 312," Fairplay, CO 80440 ",
Southern Colorado Women's Chamber of Commerce ,,,(719)442-2007, PO Box 49218," Colorado Springs, CO 80949 ",
Springfield Chamber of Commerce ,,www.ruralnet.net/~spgfld/,(719)523-4528, 748 Main St," Springfield, CO 81073 ",
Superior Chamber of Commerce ,,www.superiorchamber.com,(303)554-0789, 122 E William St," Superior, CO 80027 ",
Tri-Lakes Chamber of Commerce ,,www.trilakes.net,(719)481-3282, 300 Hwy. 105," Monument, CO 80132 ",
Vail Chamber & Business Association ,,vailchamber.org,(970)477-0075," 241 S Frontage Rd., 2 "," Vail, CO 81657 ",
Vallecito Lake Chamber of Commerce ,,www.vallecitolakechamber.com,(970)247-1573, 18071 County Road 501," Bayfield, CO 81122 ",
Washington County Chamber of Commerce ,,,(970)345-2101, PO Box 233," Akron, CO 80720 ",
Wellington Area Chamber of Commerce ,,www.wellingtoncoloradochamber.net,(970)568-4133, PO Box 1500," Wellington, CO 80549 ",
West Yuma County Chamber of Commerce ,,www.westyumachamber.com,(970)848-2704, 14 W 2nd Avenue," Yuma, CO 80759 ",
Windsor Chamber of Commerce ,,www.windsorchamber.net,(970)686-7189, 421 Main St," Windsor, CO 80550 ",
Winter Park-Fraser Valley Chamber of Commerce ,,www.winterpark-info.com,(970)726-4221," 78841 U.S Highway 40, P.O. Box 3236 "," Winter Park, CO 80482 ",
