Albany Area Chamber of Commerce ,U.S. Chamber Member,www.albanyga.com,(229)434-8700, 225 W Broad Ave," Albany, GA 31701 ",4 / 5
Americus-Sumter County Chamber of Commerce ,U.S. Chamber Member,www.sumtercountychamber.com,(229)924-2646, PO Box 724," Americus, GA 31709 ",
Athens Area Chamber of Commerce ,U.S. Chamber Member,www.athensga.com,(706)549-6800, 246 West Hancock Ave," Athens, GA 30601 ",
"ATL Airport Chamber, Inc. ",U.S. Chamber Member,www.airportchamber.com,(404)209-0910," 600 South Central Ave, Suite 100 "," Hapeville, GA 30354 ",
Augusta Metro Chamber of Commerce ,U.S. Chamber Member,www.augustagausa.com,(706)821-1300, PO Box 1837," Augusta, GA 30903 ",
Bainbridge-Decatur County Chamber of Commerce ,U.S. Chamber Member,www.bainbridgegachamber.com,(229)246-4774, 100 Boat Basin Cir," Bainbridge, GA 39817 ",
Banks County Chamber ,U.S. Chamber Member,www.bankcochamber.org,(706)677-2108, PO Box 57," Homer, GA 30547 ",
Barnesville-Lamar County Chamber of Commerce ,U.S. Chamber Member,www.barnesville.org,(770)358-5884, 100 Commerce Pl," Barnesville, GA 30204 ",
Barrow County Chamber of Commerce ,U.S. Chamber Member,www.barrowchamber.com,(770)867-9444, PO Box 456," Winder, GA 30680 ",
Baxley-Appling County Chamber of Commerce ,U.S. Chamber Member,www.baxley.org/site/,(912)367-7731, PO Box 413," Baxley, GA 31515 ",
Blairsville Union County Chamber of Commerce ,U.S. Chamber Member,www.blairsvillechamber.com,(706)745-5789, PO Box 789," Blairsville, GA 30512 ",
Brunswick-Golden Isles Chamber of Commerce ,U.S. Chamber Member,www.brunswickgoldenisleschamber.com,(912)265-0620," 1505 Richmond St, Second Floor "," Brunswick, GA 31520 ",
Cairo/Grady County Chamber of Commerce ,U.S. Chamber Member,www.cariogachamber.com,(229)377-3663, 961 North Broad St," Cairo, GA 39828 ",
Camden County Chamber of Commerce ,U.S. Chamber Member,www.camdenchamber.com,(912)729-5840, 531 North Lee St," Kingsland, GA 31548 ",
Carroll County Chamber of Commerce ,U.S. Chamber Member,www.carroll-ga.org,(770)832-2446, 200 Northside Dr," Carrollton, GA 30117 ",
Cartersville-Bartow County Chamber of Commerce ,U.S. Chamber Member,www.cartersvillechamber.com/,(770)382-1466, 122 West Main St," Cartersville, GA 30120 ",
Catoosa County Area Chamber of Commerce ,U.S. Chamber Member,www.catoosachamberofcommerce.com/,(706)965-5201, 264 Catoosa Cir," Ringgold, GA 30736 ",
Chattooga County Chamber of Commerce ,U.S. Chamber Member,www.chattoogacounty.org,(706)857-4033, PO Box 217," Summerville, GA 30747 ",
Cherokee County Chamber of Commerce ,U.S. Chamber Member,www.cherokee-chamber.com,(770)345-0400, 5422 S Joseph E Brown Mem Hwy," Canton, GA 30114 ",
Cobb Chamber of Commerce ,U.S. Chamber Member,www.cobbchamber.org,(770)980-2000, Po Box 671868," Marietta, GA 30006 ",5 / 5
Cochran-Bleckley Chamber of Commerce ,U.S. Chamber Member,www.cochran-bleckley.com/chamber-of-commerce,(478)934-2965," 102 N 2nd St, Ste A "," Cochran, GA 31014 ",
Columbia County Chamber of Commerce ,U.S. Chamber Member,www.columbiacountychamber.com,(706)860-4735, 1000 Business Blvd," Evans, GA 30809 ",5 / 5
Conyers-Rockdale Chamber of Commerce ,U.S. Chamber Member,www.conyers-rockdale.com,(770)483-7049, 936 Green St SW," Conyers, GA 30012 ",
Cordele-Crisp Chamber of Commerce ,U.S. Chamber Member,www.cordelecrispga.com,(229)273-1668, 502 South 2nd St," Cordele, GA 31010 ",
Covington/Newton County Chamber of Commerce ,U.S. Chamber Member,www.newtonchamber.com,(770)786-7510, PO Box 168," Covington, GA 30015 ",4 / 5
Dade County Chamber of Commerce ,U.S. Chamber Member,www.dadechamber.com,(706)657-4488, PO Box 1014," Trenton, GA 30752 ",
Dahlonega-Lumpkin County Chamber of Commerce ,U.S. Chamber Member,www.dahlonega.org,(706)867-3766, 13 South Park St," Dahlonega, GA 30533 ",
Dawson County Chamber of Commerce ,U.S. Chamber Member,,(706)265-6278, 44 Commerce Dr," Dawsonville, GA 30534 ",
DeKalb Chamber of Commerce ,U.S. Chamber Member,www.dekalbchamber.org,(404)378-8000," 125 Clairemont Avenue, Suite 235, Two Decatur Town Center "," Decatur, GA 30030 ",
Douglas County Chamber of Commerce ,U.S. Chamber Member,www.douglascountygeorgia.com/chamber,(770)942-5022, 6658 Church St," Douglasville, GA 30134 ",
Douglas-Coffee County Chamber & Econ Dev Authority ,U.S. Chamber Member,www.douglasga.org/,(912)384-1873," 114 Peterson Ave N, Ste 205 "," Douglas, GA 31533 ",
Dublin-Laurens County Chamber of Commerce ,U.S. Chamber Member,www.dublin-georgia.com,(478)272-5546, 1200 Bellvue Ave," Dublin, GA 31021 ",
Dunwoody Perimeter Chamber ,U.S. Chamber Member,www.dunwoodycommerce.org,(678)244-9700," 41 Perimeter Ctr E, Ste 225 "," Dunwoody, GA 30346 ",
Eastman-Dodge County Chamber of Commerce ,U.S. Chamber Member,www.eastman-georgia.com,(478)374-4723, PO Box 550," Eastman, GA 31023 ",
Eatonton Putnam Chamber of Commerce ,U.S. Chamber Member,www.eatonton.com,(706)485-7701, PO Box 4088," Eatonton, GA 31024 ",
Fayette Chamber of Commerce ,U.S. Chamber Member,www.fayettechamber.org,(770)461-9983," 600 West Lanier Ave, Suite 205 "," Fayetteville, GA 30214 ",
Forsyth County Chamber of Commerce ,U.S. Chamber Member,www.cummingforsythchamber.org,(770)887-6461, 212 Kelly Mill Rd," Cumming, GA 30040 ",
Forsyth-Monroe County Chamber of Commerce ,U.S. Chamber Member,www.forsyth-monroechamber.com,(478)994-9239, 35 S Lee St," Forsyth, GA 31029 ",
Georgia Chamber of Commerce ,U.S. Chamber Member,www.gachamber.com,(404)223-2264," 270 Peachtree Street NW, Suite 2200 "," Atlanta, GA 30303 ",
Gilmer County Chamber of Commerce ,U.S. Chamber Member,www.gilmerchamber.com,(706)635-7400, PO Box 505," Ellijay, GA 30540 ",
Gordon County Chamber of Commerce ,U.S. Chamber Member,www.gordonchamber.org,(706)625-3200, 300 South Wall St," Calhoun, GA 30701 ",
Greater Columbus Georgia Chamber of Commerce ,U.S. Chamber Member,www.columbusgachamber.com,(706)327-1566," 1200 6th Ave, P.O. Po Box 1200 "," Columbus, GA 31901 ",5 / 5
Greater Dalton Chamber of Commerce ,U.S. Chamber Member,www.daltonchamber.org,(706)278-7373, 100 South Hamilton St," Dalton, GA 30720 ",5 / 5
Greater Haralson Chamber of Commerce ,U.S. Chamber Member,www.haralson.org,(770)537-5594, 70 Murphy Campus Blvd," Waco, GA 30182 ",
Greater Macon Chamber of Commerce ,U.S. Chamber Member,www.maconchamber.org/,(478)621-2002," 305 Coliseum Dr, PO Box 169 "," Macon, GA 31202 ",
Greater North Fulton Chamber of Commerce ,U.S. Chamber Member,www.gnfcc.com,(770)993-8806," 11605 Haynes Bridge Rd, Suite 100 "," Alpharetta, GA 30004 ",
Greater Rome Chamber of Commerce ,U.S. Chamber Member,www.romega.com,(706)291-7663, 1 Riverside Pkwy," Rome, GA 30161 ",
Griffin-Spalding Chamber of Commerce ,U.S. Chamber Member,www.griffinchamber.com/,(770)228-8200, 143 North Hill St," Griffin, GA 30223 ",
Gwinnett Chamber of Commerce ,U.S. Chamber Member,www.gwinnettchamber.org,(770)232-3000, 6500 Sugarloaf Pkwy," Duluth, GA 30097 ",4 / 5
Habersham County Chamber of Commerce ,U.S. Chamber Member,www.habershamchamber.com/,(706)778-4654, 668 441 Business Hwy," Cornelia, GA 30531 ",5 / 5
Heard County Chamber of Commerce ,U.S. Chamber Member,heardchamber.com,(706)675-0560, 121 South Court Square," Franklin, GA 30217 ",
Henry County Chamber of Commerce ,U.S. Chamber Member,www.henrycounty.com/,(770)957-5786, 1709 Highway 20 West," McDonough, GA 30253 ",
Jackson County Area Chamber of Commerce ,U.S. Chamber Member,www.jacksoncountyga.com,(706)387-0300," 270 Athens St, Po Box 629 "," Jefferson, GA 30549 ",
Lee County Chamber of Commerce ,U.S. Chamber Member,www.leechamber.net,(229)759-2422, 100B Starksville Ave N," Leesburg, GA 31763 ",
Madison-Morgan Chamber of Commerce ,U.S. Chamber Member,www.madisonga.org,(706)438-3120, 118 North Main St," Madison, GA 30650 ",
Metro Atlanta Chamber of Commerce ,U.S. Chamber Member,www.metroatlantachamber.com/,(404)880-9000," 191 Peachtree Street NE, Suite 3400 "," Atlanta, GA 30303 ",
Milledgeville-Baldwin County Chamber of Commerce ,U.S. Chamber Member,www.milledgevillega.com,(478)453-9311, 130 S Jefferson St SE," Milledgeville, GA 31061 ",
Moultrie-Colquitt County Chamber of Commerce ,U.S. Chamber Member,www.moultriechamber.com,(229)985-2131, PO Box 487," Moultrie, GA 31776 ",
Murray County Chamber of Commerce ,U.S. Chamber Member,www.murraycountychamber.org/,(706)695-6060, 126 North 3rd Ave," Chatsworth, GA 30705 ",
Newnan-Coweta Chamber of Commerce ,U.S. Chamber Member,www.newnam-cowetachamber.org,(770)253-2270, 23 Bullsboro Dr," Newnan, GA 30263 ",5 / 5
Pelham Chamber of Commerce ,U.S. Chamber Member,www.pelhamchamber.org,(229)294-4924, 128 West Railroad St," Pelham, GA 31779 ",
Perry Chamber of Commerce ,U.S. Chamber Member,www.perrygachamber.com/,(478)987-1234, 900 Carroll St," Perry, GA 31069 ",
Polk County Chamber of Commerce ,U.S. Chamber Member,www.polkgeorgia.com,(770)684-8760, 133 South Marble St," Rockmart, GA 30153 ",
Richmond Hill-Bryan County Chamber of Commerce ,U.S. Chamber Member,www.rhbcchamber.org,(912)756-3444," 2591 Highway 17, Suite 100 "," Richmond Hill, GA 31324 ",
Savannah Area Chamber of Commerce ,U.S. Chamber Member,www.savannahchamber.com,(912)644-6400, 101 East Bay St," Savannah, GA 31401 ",
Statesboro-Bulloch Chamber of Commerce ,U.S. Chamber Member,www.statesboro-chamber.org,(912)489-9120, 102 South Main St," Statesboro, GA 30458 ",
Swainsboro-Emanuel County Chamber of Commerce ,U.S. Chamber Member,www.emanuelchamber.org,(478)237-6426, 102 S Main St," Swainsboro, GA 30401 ",
Thomasville-Thomas County Chamber of Commerce ,U.S. Chamber Member,www.thomasvillechamber.com,(229)226-9600, 401 South Broad St," Thomasville, GA 31792 ",
Thomson-McDuffie Chamber of Commerce ,U.S. Chamber Member,www.thomsonmcduffiechamber.com/,(706)597-1000, 149 Main St," Thomson, GA 30824 ",
Toccoa-Stephens County Chamber of Commerce ,U.S. Chamber Member,www.toccoagachamber.com/,(706)886-2132, 160 North Alexander St," Toccoa, GA 30577 ",4 / 5
Valdosta-Lowndes County Chamber of Commerce ,U.S. Chamber Member,www.valdostachamber.com,(229)247-8100, 416 North Ashley St," Valdosta, GA 31601 ",5 / 5
Walker County Chamber of Commerce ,U.S. Chamber Member,www.walkercochamber.com,(706)375-7702, 10052 North Highway 27," Rock Spring, GA 30739 ",
Walton County Chamber of Commerce ,U.S. Chamber Member,www.waltonchamber.org,(770)267-6594, 323 West Spring St," Monroe, GA 30655 ",
Warren County Chamber of Commerce ,U.S. Chamber Member,www.warrencountyga.com,(706)465-9604, 46 South Norwood St," Warrenton, GA 30828 ",
Washington County Chamber of Commerce ,U.S. Chamber Member,www.washingtoncountyga.com,(478)552-3288, 603 S Harris St," Sandersville, GA 31082 ",
Wayne County Chamber & Economic Development ,U.S. Chamber Member,www.waynechamber.com,(912)427-2028, 261 W Plum St," Jesup, GA 31545 ",
White County Chamber of Commerce ,U.S. Chamber Member,www.whitecountychamber.org/,(706)865-5356, 122 North Main St," Cleveland, GA 30528 ",5 / 5
Worth County-Sylvester Chamber of Commerce ,U.S. Chamber Member,www.swcountychamber.com,(229)776-7718, PO Box 768," Sylvester, GA 31791 ",
Paulding County Chamber of Commerce ,,www.pauldingchamber.org,(770)445-6016, 455 Jimmy Campbell Pkwy," Dallas, GA 30132 ",
Clayton County Chamber of Commerce ,,www.claytonchamber.org,(678)610-4021, 2270 Mount Zion Rd," Jonesboro, GA 30236 ",
Cobb County Travel and Tourism ,,,(678)303-2622, 1 Galleria Pkwy," Atlanta, GA 30339 ",
Donalsonville Seminole County Chamber of Commerce ,,www.donalsonvillega.com,(229)524-2588, 122 East Second St," Donalsonville, GA 39845 ",
Dooly County Chamber of Commerce ,,www.doolychamber.com/Contact-Us.html,229-268-8275, PO Box 308," Vienna, GA 31092 ",
Effingham County Chamber of Commerce ,,www.effinghamcounty.com,(912)754-3301, PO Box 1078," Springfield, GA 31329 ",
Elbert County Chamber of Commerce ,,elbertga.com,(706)283-5651, PO Box 537," Elberton, GA 30635 ",
Fitzgerald-Ben Hill Chamber of Commerce ,,www.fitzgeraldchamber.org/,(229)423-9357, 805 South Grant St," Fitzgerald, GA 31750 ",
Franklin County Chamber of Commerce ,,www.franklin-county.com,(706)384-4659, PO Box 151," Carnesville, GA 30521 ",
Greater Eastside Chamber of Commerce ,,www.eastsidechamber.com,(678)231-6341, PO Box 702," Loganville, GA 30052 ",
Greater Helen Area Chamber of Commerce ,,www.helenchamber.com,(706)878-1908, PO Box 192," Helen, GA 30545 ",
Greene County Chamber of Commerce ,,www.greeneccoc.org,(706)453-7592, 111 North Main St," Greensboro, GA 30642 ",
Harris County Chamber of Commerce ,,www.harriscountychamber.org,(706)628-0010, 112 Old College St," Hamilton, GA 31811 ",
Hart County Chamber of Commerce ,,www.hart-chamber.org,(706)376-8590, PO Box 793," Hartwell, GA 30643 ",
Hawkinsville-Pulaski County Chamber of Commerce ,,hawkinsville-pulaski.org/chamber-of-commerce/,(478)783-1717, 42 S Lumpkin St," Hawkinsville, GA 31036 ",
Johns Creek Chamber of Commerce ,,www.johnscreekchamber.com,(770)495-0545," 10475 Medlock Bridge Rd, Suite 122 "," Johns Creek, GA 30097 ",
Jones County-Gray Chamber of Commerce ,,www.jonescounty.org,(478)986-1123, 161 West Clinton St," Gray, GA 31032 ",
Liberty County Chamber of Commerce ,,www.libertycounty.org/,(912)368-4445, 208 E Court St," Hinesville, GA 31313 ",
Lincoln County Chamber of Commerce ,,www.lincolncountyga.org,(706)359-7970, PO Box 810," Lincolnton, GA 30817 ",
Madison County Chamber of Commerce ,,www.madisoncountyga.org,(706)795-3473, 101 Court House Sq," Danielsville, GA 30633 ",
Meriwether County Chamber of Commerce ,,www.meriwethercountychamber.org,(706)655-2558, 91 Broad Street," Warm Springs, GA 31830 ",
Oconee County Chamber of Commerce ,,www.occoc.org,(706)769-7947, PO Box 348," Watkinsville, GA 30677 ",
Okefenokee Chamber of Commerce ,,www.folkston.com,(912)496-2536, 3795 Main St," Folkston, GA 31537 ",
Peach County Chamber of Commerce ,,www.peachcountyga.com,(478)747-6200," 201 Oakland Heights Pkwy, The Troutman House "," Fort Valley, GA 31030 ",
Pickens County Chamber of Commerce ,,www.pickenschamber.com,(706)692-5600, 500 Stegall Dr.," Jasper, GA 30143 ",
Pike County Chamber of Commerce ,,pikecountygachamber.com/,(770)567-2029, PO Box 1147," Zebulon, GA 30295 ",
Quitman-Brooks County Chamber of Commerce ,,www.qbcchamber.com/,(229)263-4841, PO Box 151," Quitman, GA 31643 ",
Rabun County Chamber of Commerce ,,www.gamountains.com/commerce,(706)782-4812, PO Box 750," Clayton, GA 30525 ",
Screven County Chamber of Commerce ,,www.screvencounty.com,(912)564-7878, 101 South Main St," Sylvania, GA 30467 ",
Thomaston Upson County Chamber of Commerce ,,www.thomastonchamber.com,(706)647-9686, PO Box 827," Thomaston, GA 30286 ",
Tifton Tift County Chamber of Commerce ,,www.tiftonchamber.org,(229)382-6200, PO Box 165," Tifton, GA 31793 ",
Toombs County Chamber of Commerce ,,www.toombschamber.com,(912)537-4466, 2805 East First St," Vidalia, GA 30474 ",
African American Chamber Of Commerce ,,,(770)662-3969, 4880 Glen White Dr," Duluth, GA 30096 ",
Alma-Bacon County Chamber of Commerce ,,www.abcchamber.org,(912)632-5859," Hwy. 32 W, P.O. Box 450 "," Alma, GA 31510 ",
Buckhead & Intl. Chamber of Commerce ,,,(404)266-9867, 4109 Statewood Rd.," Atlanta, GA 30342 ",
Buena Vista-marion County Chamber of Commerce ,,www.bvmccoc.com,(229)649-2842, PO Box 471," Buena Vista, GA 31803 ",
Burke County Chamber of Commerce ,,,(706)554-5451, 241 E 6th St," Waynesboro, GA 30830 ",
Butts County Chamber of Commerce ,,www.ButtsChamber.com,(770)775-4839, 625 W 3rd St," Jackson, GA 30233 ",
Camilla Chamber of Commerce ,,www.camillageorgia.com,(229)336-5255, 212 E Broad St.," Camilla, GA 31730 ",
Claxton-Evans County Chamber of Commerce ,,www.claxton-evans-georgia-chamber.com,(912)739-1391, 4 N Duval St.," Claxton, GA 30417 ",
Colquitt-Miller County Chamber of Commerce ,,www.colquitt-georgia.com,(229)758-2400, 302 E College St," Colquitt, GA 39837 ",
Columbus Black Chamber of Commerce ,,www.columbus-ga.org/CBCC,, PO Box 5689," Columbus, GA 31906 ",
Darien & McIntosh County Chamber of Commerce ,,www.mcintoshcounty.com,(912)437-6684," 105 Fort King George Dr., P.O. Box 1497 "," Darien, GA 31305 ",
Darien-Mcintosh County Chamber of Commerce & Visit ,,www.visitdarien.com,(912)437-6684," 1111 Magnolia Bluff Way SW, Ste 410 "," Darien, GA 31305 ",
Ellaville-Schley County Chamber of Commerce ,,,(229)937-2262, PO Box 4," Ellaville, GA 31806 ",
Fannin County Chamber of Commerce ,,www.blueridgemountains.com,(706)632-5680, 3990 Appalachian Hwy.," Blue Ridge, GA 30513 ",
Greater Hall Chamber of Commerce ,,www.ghcc.com,(770)532-6206, 230 EE Butler Pkwy.," Gainesville, GA 30501 ",
Greater Lithonia/Snapfinger Woods CoC ,,,, PO Box 57," Lithonia, GA 30058 ",
Greater Tattnall Chamber of Commerce ,,www.tattnall.com,(912)557-4335, PO Box 759," Reidsville, GA 30453 ",
Hazlehurst-Jeff Davis County Chamber ofCommerce ,,www.hazlehurst-jeffdavis.com,(912)375-4543," 95 E Jarman St., P.O. Box 546 "," Hazlehurst, GA 31539 ",
Homerville-Clinch County Chamber of Commerce ,,,(912)487-2360, 101 S College St.," Homerville, GA 31634 ",
International Christian CoC-GA ,,,(678)939-1301, 1830 Valley Brook Dr," Alpharetta, GA 30005 ",
Jefferson County Chamber of Commerce ,,jeffersoncounty.org,(478)625-8134," 302 E Broad St., P.O. Box 630 "," Louisville, GA 30434 ",
Lake Park Area CoC and Visitors Center ,,www.lakeparkga.com,(229)559-5302," 5208 Jewel Futch Dr., P.O. Box 278 "," Lake Park, GA 31636 ",
Lakeland-Lanier County Chamber of Commerce ,,www.lakelandchamber.org,(229)482-9755, 8 Valdosta Rd," Lakeland, GA 31635 ",
Lavonia Chamber of Commerce ,,www.lavoniachamber.org,(706)356-8202, PO Box 763," Lavonia, GA 30553 ",
Long County Chamber of Commerce ,,www.longcountychamber.com,(912)545-2367, PO Box 400," Ludowici, GA 31316 ",
Macon County Chamber of Commerce ,,www.maconchamber.com,(478)472-2391, 109 N Dooly St.," Montezuma, GA 31063 ",
Metter-Candler County Chamber of Commerce ,,www.metter-candler.com,(912)685-2159," 1210 S Lewis St, P.O. Box 497 "," Metter, GA 30439 ",
Monticello-jasper County Chamber of Commerce ,,www.historicmonticello.com,(706)468-8994, 119 W Washington St," Monticello, GA 31064 ",
Nashville-Berrien Chamber of Commerce ,,www.berrienchamber.com,(229)686-5123, 201 N Jefferson St.," Nashville, GA 31639 ",
North Bryan County Chamber of Commerce ,,www.bryancounty.org,(912)653-2244, PO Box 916," Pembroke, GA 31321 ",
Ocilla-Irwin Chamber of Commerce ,,,(229)468-9114, PO Box 104," Ocilla, GA 31774 ",
Oglethorpe County Chamber of Commerce ,,,(706)743-3113, PO Box 56," Crawford, GA 30630 ",
Perry Area Chamber Of Commerce ,,,(478)987-1234," 101 General Courtney Hodges Blvd, Suite B "," Perry, GA 31069 ",
Pierce County Chamber of Commerce ,,www.pcgeorgia.com,(912)449-7044, 200 South Central Ave," Blackshear, GA 31516 ",
Pine Mountain Chamber of Commerce ,,,(706)663-8850, PO Box 483," Pine Mountain, GA 31822 ",
Polk County Chamber of Commerce In Cedartown ,,www.polkgeorgia.com,(770)749-1652, 609 Main St," Cedartown, GA 30125 ",
Port Wentworth Chamber of Commerce ,,www.portwentworthga.com,(912)965-1999, PO Box 4186," Port Wentworth, GA 31407 ",
Roberta-Crawford County Chamber of Commerce ,,www.robertacrawfordchamber.org,(478)836-3825," 38 Wright Ave., P.O. Box 417 "," Roberta, GA 31078 ",
Soperton-treutlen Chamber of Commerce ,,www.soperton.org,(912)529-6868, 488 Second St," Soperton, GA 30457 ",
South Fulton Chamber of Commerce ,,southfultonchamber.com,(770)964-1984," 4405 Mall Blvd, Suite 120 "," Union City, GA 30291 ",
South Georgia Chamber of Commerce ,,sogachamber.com,(912)228-1299, PO Box 756," Hazlehurst, GA 31539 ",
Southwest Quarter Chattahoochee Reg. CoC ,,,(229)732-2683," 201 N Lumpkin St., P.O. Box 31 "," Cuthbert, GA 39840 ",
Talbot County Chamber of Commerce ,,www.talbotcountychamber.org,(706)665-8079, PO Box 98," Talbotton, GA 31827 ",
Telfair County Chamber of Commerce ,,www.telfairco.com,(229)868-6365, 120 E Oak St.," McRae-Helena, GA 31055 ",
Terrell County Chamber of Commerce ,,www.terrellcountygeorgia.org,(229)995-2011, 211 W Lee St," Dawson, GA 39842 ",
Towns County Chamber of Commerce ,,www.mountaintopga.com,(706)896-4966, 1411 Fuller Cir.," Young Harris, GA 30582 ",
Washington-wilkes Chamber of Commerce ,,www.washingtonwilkes.org,, PO Box 661," Washington, GA 30673 ",
Waycross-Ware County Chamber of Commerce ,,waycrosschamber.us,(912)283-3742," 315 Plant Ave, Ste B "," Waycross, GA 31501 ",
Wheeler County Chamber of Commerce ,,,(912)568-7808, PO Box 654," Alamo, GA 30411 ",
Wilcox County Chamber of Commerce ,,www.wilcoxga.com,, 1001 1st Avenue," Rochelle, GA 31079 ",
Women's Chamber of Commerce of Atlanta ,,,(770)740-8081, PO Box 18765," Atlanta, GA 31126 ",
Wrightsville-Johnson County Chamber Of Commerce ,,,(478)864-7200, PO Box 94," Wrightsville, GA 31096 ",
