Bangor Region Chamber of Commerce ,U.S. Chamber Member,www.bangorregion.com,(207)947-0307," 2 Hammond St, Ste 1"," Bangor, ME 04401 ",
Central Aroostook Chamber of Commerce ,U.S. Chamber Member,www.pichamber.com,(207)764-6561, 3 Houlton Rd," Presque Isle, ME 04769 ",
Kennebec Valley Chamber of Commerce ,U.S. Chamber Member,www.augustamaine.com,(207)623-4559, 269 Western Ave," Augusta, ME 04332 ",
Kennebunk-Kennebunkport-Arundel Chamber of Commerc ,U.S. Chamber Member,www.gokennebunks.com/,(207)967-0857, 16 Water St," Kennebunk, ME 04043 ",
Maine State Chamber of Commerce ,U.S. Chamber Member,www.mainechamber.org,(207)623-4568," 125 Community Dr, Suite 101 "," Augusta, ME 04330 ",
Mid-Maine Chamber of Commerce ,U.S. Chamber Member,www.midmainechamber.com/,(207)873-3316, 50 Elm St," Waterville, ME 04901 ",
Penobscot Bay Regional Chamber of Commerce ,U.S. Chamber Member,mainedreamvacation.com,(207)236-4404, PO Box 919," Camden, ME 04843 ",
Sanford-Springvale Chamber of Commerce ,U.S. Chamber Member,www.sanfordchamber.org,(207)324-4280," 917 Main St, #B"," Sanford, ME 04073 ",
Skowhegan Regional Chamber of Commerce ,U.S. Chamber Member,www.skowheganchamber.com,(207)474-3621, 23 Commercial St.," Skowhegan, ME 04976 ",
Wells Chamber of Commerce ,U.S. Chamber Member,www.wellschamber.org,(207)646-2451, PO Box 356," Wells, ME 04090 ",
Bethel Area Chamber of Commerce ,,www.bethelmaine.com/,(207)824-2282, PO Box 1247," Bethel, ME 04217 ",
Boothbay Harbor Region Chamber of Commerce ,,www.boothbayharbor.com/,(207)633-2353, 192 Townsend Avenue," Boothbay Harbor, ME 04538 ",
Ellsworth Area Chamber of Commerce ,,www.ellsworthchamber.org/,(207)667-5584, 163 High Street," Ellsworth, ME 04605 ",
Greater Bridgton Lakes Region Chamber of Commerce ,,www.mainelakeschamber.com/,(207)647-3472, 101 Portland Rd," Bridgton, ME 04009 ",
Greater Houlton Chamber of Commerce ,,www.greaterhoulton.com,(207)532-4216, 109 Main St," Houlton, ME 04730 ",
Greater York Region Chamber of Commerce ,,www.gatewaytomaine.org,(207)363-4422, 1 Stonewall Ln," York, ME 03909 ",
Katahdin Area Chamber of Commerce ,,www.katahdinmaine.com,(207)723-4443, 1029 Central St," Millinocket, ME 04462 ",
Lewiston Auburn Metropolitan Chamber of Commerce ,,www.lametrochamber.com,(207)783-2249, 415 Lisborn St," Lewiston, ME 04243 ",
Machias Bay Area Chamber of Commerce ,,www.machiaschamber.org/,(207)255-4402, PO Box 606," Machias, ME 04654 ",
Portland Regional Chamber of Commerce ,,www.portlandregion.com,(207)772-2811, 443 Congress St," Portland, ME 04101 ",
Sebago Lakes Region Chamber of Commerce ,,sebagolakeschamber.com,(207)892-8265, PO Box 1015," Windham, ME 04062 ",
Southern Midcoast Maine Chamber ,,www.midcoastmaine.com,(207)725-8797, 8 Venture Ave," Brunswick, ME 04011 ",
St. Croix Valley Chamber of Commerce ,,www.visitstcroixvalley.com,(207)454-2308, 39 Union St," Calais, ME 04619 ",
Androscoggin County Chamber of Commerce ,,www.androscoggincounty.com,(207)783-2249, 179 Lisbon St.," Lewiston, ME 04240 ",
Belfast Area Chamber of Commerce ,,www.belfastmaine.org,(207)338-5900, 14 Main St," Belfast, ME 04915 ",
Biddeford Saco Chamber of Commerce & Industry ,,www.biddefordsacochamber.org,(207)282-1567, 28 Water St," Biddeford, ME 04005 ",
Blue Hill Peninsula Chamber of Commerce ,,www.bluehillpeninsula.org,(207)374-3242," 16 South St, Suite B "," Blue Hill, ME 04614 ",
Boothbay Harbor Region Chamber ofCommerce ,,www.boothbayharbor.com,(207)633-4743," 323 Townsend Ave., P.O. Box 187 "," Boothbay, ME 04537 ",
Bucksport Bay Area Chamber of Commerce ,,www.bucksportchamber.org,(207)469-6818, PO Box 1880," Bucksport, ME 04416 ",
China Area Chamber of Commerce ,,,(207)445-2890, PO Box 189," South China, ME 04358 ",
Cobscook Bay Area Chamber of Commerce ,,www.cobscookbay.com,, PO Box 42," Whiting, ME 04691 ",
Damariscotta Region Chamber of Commerce ,,www.damariscottaregion.com,(207)563-8340, PO Box 13," Damariscotta, ME 04543 ",
Deer Isle-Stonington Chamber of Commerce ,,www.deerislemaine.com,(207)348-6124, PO Box 490," Deer Isle, ME 04627 ",
Downeast Coastal Chamber of Commerce ,,,(207)483-2131, PO Box 333," Harrington, ME 04643 ",
Eastport Area Chamber of Commerce ,,www.eastportchamber.net,(207)853-4644," 141 Water St, PO Box 254 "," Eastport, ME 04631 ",
Franklin County Chamber of Commerce ,,www.franklincountymaine.org,2077784215, 615 Wilton Road," Farmington, ME 04938 ",
Gateway to Maine Chamber of Commerce ,,www.gatewaytomaine.org,(207)439-7545, PO Box 526," Kittery, ME 03904 ",
Greater East Grand Lake Chamber of Commerce ,,www.eastgrandlake.net,(207)448-7739, PO Box 195," Danforth, ME 04424 ",
Greater Fort Kent Area Chamber of Commerce ,,www.fortkentchamber.com,(207)834-5354, 291 W Main St," Fort Kent, ME 04743 ",
Greater Van Buren Chamber of Commerce ,,,(207)868-5059, 65 Main St.," Van Buren, ME 04785 ",
Hallowell Area Board of Trade ,,,(207)620-7477, PO Box 246," Hallowell, ME 04347 ",
Limestone Chamber of Commerce ,,,(207)325-4025, 93 Main St.," Limestone, ME 04750 ",
Lincoln Chamber of Commerce ,,www.lincolnmaine.org,(207)794-8065," 75 Main St., P.O. Box 164 "," Lincoln, ME 04457 ",5 / 5
Lubec Chamber of Commerce ,,,(207)733-4522, PO Box 123," Lubec, ME 04652 ",
Moosehead Lake Region Chamber of Commerce ,,www.mooseheadlake.org,(207)695-2702," 480 Moosehead Lake Road (Rt. 15), P.O. Box 581 "," Greenville, ME 04441 ",
Mount Desert Chamber of Commerce ,,,," Sea St., P.O. Box 675 "," Northeast Harbor, ME 04662 ",
Norridgewock Area Chamber of Commerce ,,www.norridgewockareachamber.com,(207)431-5188, PO Box 184," Norridgewock, ME 04957 ",
Northern Kathadin Valley Reg. Chamber of Commerce ,,www.allmaine.com/nkvrcc,(207)463-2077," 1057 Crystal Rd., 1 "," Island Falls, ME 04747 ",
Ogunquit Chamber of Commerce ,,www.ogunquit.org,(207)646-2939, 36 U.S Route 1," Ogunquit, ME 03907 ",
Old Orchard Beach Chamber of Commerce ,,www.oldorchardbeachmaine.com,(207)934-2500, First St.," Old Orchard Beach, ME 04064 ",
Oxford Hills Chamber of Commerce ,,www.oxfordhillsmain.com,(207)743-2281, 4 Western Ave," South Paris, ME 04281 ",
Piscataquis Chamber of Commerce ,,www.piscataquischamber.com,(207)564-7533, 1033 South St," Dover-Foxcroft, ME 04426 ",
Rangeley Lakes Reg.Chamber of Commerce ,,www.rangeleymaine.com,(207)864-5571, 6 Park Rd.," Rangeley, ME 04970 ",
River Valley Chamber of Commerce ,,www.rivervalleychamber.com,(207)364-3241, 10 Bridge St," Rumford, ME 04276 ",
Schoodic Peninsula Area Chamber of Commerce ,,www.acadia-schoodic.org,, PO Box 381," Winter Harbor, ME 04693 ",
Southwest Harbor-tremont Chamber of Commerce ,,www.acadiachamber.com,(207)244-9264, PO Box 1143," Southwest Harbor, ME 04679 ",
The Forks Area Chamber of Commerce ,,www.forksarea.com,(207)663-2121, PO Box 1," West Forks, ME 04985 ",
The St. John Valley Chamber of Commerce ,,www.greatermadawaskachamber.com,(207)728-7000, PO Box 144," Madawaska, ME 04756 ",
Union Area Chamber of Commerce ,,,(207)785-6300, PO Box 603," Union, ME 04862 ",
Upper Kennebec Valley Chamber of Commerce ,,,(207)672-4100, PO Box 491," Bingham, ME 04920 ",
Winthrop Lakes Region Chamber of Commerce ,,www.winthropchamber.org,(207)377-8020, PO Box 51," Winthrop, ME 04364 ",
Yarmouth Chamber of Commerce ,,www.yarmouthmaine.org,(207)846-3984, 162 Main St," Yarmouth, ME 04096 ",
