Carson City Area Chamber of Commerce ,U.S. Chamber Member,www.carsoncitychamber.com,(775)882-1565," 1900 S Carson St, Ste 200 "," Carson City, NV 89701 ",
Carson Valley Chamber of Commerce ,U.S. Chamber Member,www.carsonvalleynv.org,(775)782-8144," 1477 US Highway 395 North, Suite A "," Gardnerville, NV 89410 ",
Elko Area Chamber of Commerce ,U.S. Chamber Member,www.elkonevada.com,(775)738-7135, 1405 Idaho St," Elko, NV 89801 ",
Henderson Chamber of Commerce ,U.S. Chamber Member,www.hendersonchamber.com,(702)565-8951," 400 N Green Valley Pkwy, #2"," Henderson, NV 89074 ",
Las Vegas Metro Chamber of Commerce ,U.S. Chamber Member,www.lvchamber.com,(702)586-3869," 575 W Symphony Park Ave, Suite 100 "," Las Vegas, NV 89106 ",
Laughlin Chamber of Commerce ,U.S. Chamber Member,www.laughlinchamber.com,(702)298-2214, 1585 South Casino Dr," Laughlin, NV 89029 ",
Reno + Sparks Chamber of Commerce ,U.S. Chamber Member,www.thechambernv.org,(775)636-9550," 449 South Virginia St, #300"," Reno, NV 89501 ",
Boulder City Chamber of Commerce ,,www.bouldercitychamberofcommerce.com,(702)293-2034, 465 Nevada Way," Boulder City, NV 89005 ",
Humboldt County Chamber of Commerce ,,www.winnemuccachamber.blogspot.com,(775)623-2225, 30 West Winnemucca Blvd," Winnemucca, NV 89445 ",
Mesquite Chamber of Commerce ,,www.mesquitechamber.com/,(702)346-2902," 11 West Pioneer Blvd, Suite C "," Mesquite, NV 89027 ",
Mineral County Chamber of Commerce ,,www.mineralcountychamber.com,(775)945-2507, PO Box 2250," Hawthorne, NV 89415 ",
Pahrump Valley Chamber of Commerce ,,www.pahrumpchamber.com,(775)727-5800, 1301 South Highway 160," Pahrump, NV 89048 ",
White Pine Chamber of Commerce ,,www.whitepinechamber.com,(775)289-8877, 636 Aultman St," Ely, NV 89301 ",
Women's Chamber of Commerce of Nevada ,,www.womenschamberofnevada.org,(702)733-3955," 2300 West Sahara Ave, Suite 800 "," Las Vegas, NV 89102 ",
Amargosa Valley Chamber of Commerce ,,amargosachamber.com,(775)372-5459, PO Box 2," Amargosa Valley, NV 89020 ",
Battle Mountain Chamber of Commerce ,,www.the-onramp.net/battlemountain,(775)635-8245, PO Box 333," Battle Mountain, NV 89820 ",
Beatty Chamber of Commerce ,,,(775)553-2424, PO Box 956," Beatty, NV 89003 ",
Caliente Chamber ofCommerce ,,,(775)726-3129, PO Box 553," Caliente, NV 89008 ",
Eureka Chamber of Commerce & Visitors Center ,,www.ecedc.org,," 11 N Main, P.O. Box 1078 "," Eureka, NV 89316 ",
Fernley Chamber of Commerce ,,fernleychamber.org,(775)575-4459, 70 N West St.," Fernley, NV 89408 ",
Goldfield Chamber of Commerce ,,www.geocities.com/goldfieldchamber,(775)485-3560, PO Box 204," Goldfield, NV 89013 ",
Greater Austin Chamber of Commerce ,,www.austinnevada.com,(775)964-2200," PO Box 212, P.O. Box 212 "," Austin, NV 89310 ",
Greater Fallon Area Chamber of Commerce ,,www.fallonchamber.com,(775)423-2544," 65 S Maine St., C "," Fallon, NV 89406 ",
Latin Chamber of Commerce ,,www.lvlcc.starchapter.com,(702)385-7367," 829 S Sixth St., 3 "," Las Vegas, NV 89125 ",
Lovelock/Pershing County Chamber of Commerce ,,www.Zplace2b.com/PCCofC,(775)273-7213, 350 Main St," Lovelock, NV 89419 ",
Mason Valley Chamber of Commerce ,,www.yeringtonchamber.org,(775)463-2245," 227 S Main St., PO Box 1692 "," Yerington, NV 89447 ",
Nevada State C Of C ,,www.renosparkschamber.org,," 1 E 1st St, Ste 1600 "," Reno, NV 89501 ",
Pioche Chamber of Commerce ,,,(775)962-5544, PO Box 127," Pioche, NV 89043 ",
Silver Springs Area Chamber of Commerce ,,www.silverspringsnevada.com,(775)577-4336, PO Box 617," Silver Springs, NV 89429 ",
Tonopah Chamber of Commerce ,,,(775)482-3859," 301 Brougher Ave., P.O. Box 869 "," Tonopah, NV 89049 ",
Urban Chamber Of Commerce ,,,(702)648-6222," 1951 Stella Lake St, Ste 26 "," Las Vegas, NV 89106 ",
Virginia City/Gold Hill Chamber of Commerce ,,,," 131 S C St., P.O. Box 464 "," Virginia City, NV 89440 ",
Wells Chamber of Commerce ,,wellsnv.com,(775)752-3540, PO Box 615," Wells, NV 89835 ",
