Anderson Area Chamber of Commerce ,U.S. Chamber Member,www.andersonscchamber.com,(864)226-3454," 907 North Main St, Suite 200 "," Anderson, SC 29621 ",4 / 5
Beaufort Regional Chamber of Commerce ,U.S. Chamber Member,www.beaufortsc.org,(843)525-8500, 1106 CARTERET ST," Beaufort, SC 29902 ",
Berkeley County Chamber of Commerce ,U.S. Chamber Member,www.bcoc.com,(843)761-8238, PO Box 968," Moncks Corner, SC 29461 ",
Charleston Metro Chamber of Commerce ,U.S. Chamber Member,www.charlestonchamber.net,(843)805-3031," 4500 Leeds Avenue, Suite 100 "," North Charleston, SC 29405 ",5 / 5
Cherokee County Chamber of Commerce ,U.S. Chamber Member,www.cherokeechamber.org,(864)489-5721, 225 South Limestone St," Gaffney, SC 29340 ",
Chester County Chamber of Commerce ,U.S. Chamber Member,www.chesterchamber.com/,(803)581-4142, PO Box 489," Chester, SC 29706 ",
Georgetown County Chamber of Commerce ,U.S. Chamber Member,www.visitgeorge.com,(843)546-8436, 531 Front St.," Georgetown, SC 29440 ",
Greater Aiken Chamber of Commerce ,U.S. Chamber Member,www.aikenchamber.net/,(803)641-1111, PO Box 892," Aiken, SC 29802 ",5 / 5
Greater Chapin Chamber of Commerce ,U.S. Chamber Member,www.chapinchamber.com,(803)345-1100, 302 Columbia Ave.," Chapin, SC 29036 ",
Greater Columbia Chamber of Commerce ,U.S. Chamber Member,www.columbiachamber.com,(803)733-1110, 930 Richland St," Columbia, SC 29201 ",
Greater Florence Chamber of Commerce ,U.S. Chamber Member,florencescchamber.com,(843)665-0515, 100 West Evans St," Florence, SC 29501 ",
Greater Greer Chamber of Commerce ,U.S. Chamber Member,www.greerchamber.com,(864)877-3131, 111 Trade St," Greer, SC 29651 ",
Greater Lexington Chamber and Visitors Center ,U.S. Chamber Member,www.lexingtonsc.org,(803)359-6113, 311 West Main St," Lexington, SC 29072 ",4 / 5
Greater Summerville/Dorchester County Chamber ,U.S. Chamber Member,greatersummerville.org,(843)873-2931, PO Box 670," Summerville, SC 29484 ",5 / 5
Greenville Chamber ,U.S. Chamber Member,www.greenvillechamber.org/,(864)242-1050," 550 South Main St, Suite 550 "," Greenville, SC 29601 ",4 / 5
Greenwood Chamber of Commerce ,U.S. Chamber Member,www.greenwoodscchamber.org,(864)223-8431, PO Box 980," Greenwood, SC 29648 ",
Hilton Head Island-Bluffton Chamber of Commerce ,U.S. Chamber Member,www.hiltonheadchamber.org,(843)785-3673," 1 Chamber of Commerce Dr, Chamber of Commerce Building "," Hilton Head Island, SC 29928 ",5 / 5
Jasper County Chamber of Commerce ,U.S. Chamber Member,www.jaspersc.org,(843)726-8126, PO Box 1267," Ridgeland, SC 29936 ",
Kershaw County Chamber of Commerce ,U.S. Chamber Member,www.camden-sc.org,(803)432-2525, PO Box 605," Camden, SC 29021 ",
Lancaster County Chamber of Commerce ,U.S. Chamber Member,lancasterchambersc.org,(803)283-4105, PO Box 430," Lancaster, SC 29721 ",
Laurens County Chamber of Commerce ,U.S. Chamber Member,www.laurenscounty.org,(864)833-2716, PO Box 248," Laurens, SC 29360 ",
Little River Chamber of Commerce & Visitors Center ,U.S. Chamber Member,business.littleriverchamber.org,(843)249-6604," 1180 Highway 17 North, Suite 1 "," Little River, SC 29566 ",
Marlboro Chamber Of Commerce ,U.S. Chamber Member,,(843)535-8184, Po Box 1888," Bennettsville, SC 29512 ",
Mount Pleasant Chamber Of Commerce ,U.S. Chamber Member,www.mountpleasantchamber.org,(843)800-2258, PO Box 1635," Mount Pleasant, SC 29465 ",
Myrtle Beach Area Chamber of Commerce ,U.S. Chamber Member,www.myrtlebeachareachamber.com/,(843)626-7444, 1200 Oak St," Myrtle Beach, SC 29577 ",5 / 5
North Augusta Chamber of Commerce ,U.S. Chamber Member,,(803)279-2323, Po Box 6246," North Augusta, SC 29861 ",
Simpsonville Area Chamber of Commerce ,U.S. Chamber Member,www.simpsonvillechamber.com,(864)963-3781, 100 W Trade St," Simpsonville, SC 29681 ",
South Carolina Chamber of Commerce ,U.S. Chamber Member,www.scchamber.net,(803)799-4601," 1301 Gervais St, Suite 1100 "," Columbia, SC 29201 ",
Spartanburg Area Chamber of Commerce ,U.S. Chamber Member,www.spartanburgchamber.com,(864)594-5000, PO Box 1636," Spartanburg, SC 29304 ",
Union County Chamber of Commerce ,U.S. Chamber Member,www.unionsc.com,(864)427-9039," 135 W Main St, Union County Chamber "," Union, SC 29379 ",
Walterboro-Colleton Chamber of Commerce ,U.S. Chamber Member,www.walterboro.org,(843)549-9595," 403 East Washington St, Suite A "," Walterboro, SC 29488 ",
York County Regional Chamber of Commerce ,U.S. Chamber Member,www.yorkcountychamber.com/,(803)324-7500, PO Box 590," Rock Hill, SC 29731 ",
Clemson Area Chamber of Commerce ,,www.clemsonareachamber.org/,(864)654-1200, PO Box 1622," Clemson, SC 29633 ",
Conway Area Chamber of Commerce ,,www.conwayscchamber.com,(843)248-2273, 203 Main St," Conway, SC 29526 ",
Edisto Chamber of Commerce ,,www.edistochamber.com/,(843)869-3867, 430 Highway 174," Edisto Island, SC 29438 ",
Fairfield County Chamber of Commerce ,,www.fairfieldchamber.org,(803)635-4242, PO Box 297," Winnsboro, SC 29180 ",
Greater Bluffton Chamber of Commerce ,,blufftonchamberofcommerce.org,(843)757-1010, 217 Goethe Rd," Bluffton, SC 29910 ",
Greater Cheraw Chamber of Commerce ,,www.cheraw.com,(843)537-7681, 221 Market St," Cheraw, SC 29520 ",
Greater Darlington Chamber of Commerce ,,www.darlingtonchamber.com,(843)393-2641, 38 Public Sqaure," Darlington, SC 29532 ",
Greater Easley Chamber of Commerce ,,www.easleychamber.org,(864)859-2693, PO Box 241," Easley, SC 29641 ",
Greater Sumter Chamber of Commerce ,,www.sumterchamber.com/,(803)775-1231, 32 East Calhoun St," Sumter, SC 29150 ",4 / 5
Marion Chamber of Commerce ,,www.marionscchamber.com,(843)423-3561, PO Box 35," Marion, SC 29571 ",
Midland Valley Area Chamber of Commerce ,,www.midlandvalleyareachamberofcommerce.com,(803)593-3030, 1805 Jefferson Davis Hwy," Warrenville, SC 29851 ",
Newberry County Chamber of Commerce ,,www.newberrycountychamber.com,(803)276-4274, Po Box 396," Newberry, SC 29108 ",
Oconee County Chamber of Commerce ,,www.oconeechambersc.com,(864)882-2097, 105 West South Broad St," Walhalla, SC 29691 ",
Orangeburg County Chamber of Commerce ,,www.orangeburgchamber.com,(803)534-6821, 155 Riverside Drive SW," Orangeburg, SC 29116 ",
Allendale County Chamber of Commerce ,,,(803)584-0082, PO Box 517," Allendale, SC 29810 ",
Aynor Chamber of Commerce ,,,(843)358-4808, PO Box 10," Aynor, SC 29511 ",
Bamberg County Chamber of Commerce ,,www.BambergCountyChamber.com,(803)245-4427, 604 Airport Rd.," Bamberg, SC 29003 ",
Barnwell County Chamber of Commerce ,,,(803)259-7446," 367 Fuldner Rd., P.O. Box 898 "," Barnwell, SC 29812 ",
Batesburg-LeesvilleChamber of Commerce ,,,(803)532-4339," 350 E Columbia Ave., P.O. Box 2178 "," Batesburg-Leesville, SC 29006 ",
Bennettsville Chamber of Commerce ,,www.visitbennettsville.com,, 304 W Main St," Bennettsville, SC 29512 ",
Calhoun County Chamber of Commerce ,,Calhounchamber@sc.rr.com,(803)655-5650," Courthouse Annex, 114 "," Saint Matthews, SC 29135 ",
Clarendon County Chamber of Commerce ,,www.clarendoncounty.com,(803)435-4405, 19 N Brooks St.," Manning, SC 29102 ",
Dillon County Chamber of Commerce ,,,(843)774-8551, 100 N Macarthur Ave," Dillon, SC 29536 ",
Edgefield County Chamber of Commerce ,,www.edgefieldcountychamber.org,(803)275-0010, 416 Calhoun St," Johnston, SC 29832 ",
Fountain Inn Chamber of Commerce ,,www.fountaininnchamber.org,(864)862-2586, 102 Depot St," Fountain Inn, SC 29644 ",
Greater Abbeville Chamber of Commerce ,,www.visitabbevillesc.com,(864)366-4600, 107 Court Square," Abbeville, SC 29620 ",
Greater Area Walhalla Chamber of Commerce ,,walhallasc.com,(864)638-2727, 214 E Main St.," Walhalla, SC 29691 ",
Greater Cayce West Columbia Chamber of Commerce ,,www.cwcchamber.com,(803)794-6504, 1006 12th St.," Cayce, SC 29033 ",
Greater Chesterfield Chamber of Commerce ,,,(843)623-2343, PO Box 350," Chesterfield, SC 29709 ",
Greater Clover Chamber of Commerce ,,www.cloverchamber.org,(803)222-3312, 118 Bethel St.," Clover, SC 29710 ",
Greater Hardeeville Chamber of Commerce ,,www.hardeevillechamber.net,(843)784-3606," 32a Hwy. 17 N, P.O. Box 307 "," Hardeeville, SC 29927 ",
Greater Inman Area Chamber of Commerce ,,www.inmanscchamber.org,(864)472-3654, PO Box 227," Inman, SC 29349 ",
Greater Irmo Chamber of Commerce ,,www.irmochamber.com,(803)749-9355, 1235 Columbia Ave," Irmo, SC 29063 ",
Greater Lake City Chamber of Commerce ,,www.lakecitysc.org,(843)374-8611, 144 S Acline St.," Lake City, SC 29560 ",
Greater Mullins Chamber of Commerce ,,"mullins,sc.com",(843)464-6651, One N Main St.," Mullins, SC 29574 ",
Greater Pickens Chamber of Commerce ,,www.pickenschamberofcommerce.com/,(864)878-3258," 222 W Main St., P.O. Box 153 "," Pickens, SC 29671 ",
Greater Woodruff Chamber of Commerce ,,,, PO Box 182," Woodruff, SC 29388 ",
Greater York Chamber of Commerce ,,www.greateryorkchamber.com,(803)684-2590, 23 East Liberty St.," York, SC 29745 ",
Hampton County Chamber of Commerce ,,,(803)914-2143," PO Box 122, P.O. Box 122 "," Hampton, SC 29924 ",
Lake Wylie Chamber of Commerce ,,www.lakewyliesc.com,(803)831-2827," 264 Latitude Ln, #101"," Clover, SC 29710 ",
Laurens County Chamber of Commerce ,,www.laurenscounty.org,(864)833-2716, PO BOX 248," Laurens, SC 29360 ",
"Lexington Chamber Of Commerce, Inc. ",,,, PO Box 44," Lexington, SC 29071 ",
Liberty Chamber of Commerce ,,www.libertychamberofcommerce.com,(336)622-4937," PO Box 123, P.O. Box 986 "," Liberty, SC 29657 ",
Loris Chamber of Commerce ,,,(843)756-6030," 4242 Main St., P.O. Box 356 "," Loris, SC 29569 ",
Mauldin Area Chamber of Commerce ,,www.mauldinchamber.org,(864)297-1323, PO Box 881," Mauldin, SC 29662 ",
McCormick County Chamber of Commerce ,,www.mccormickscchamber.org,(864)465-2835," 100 S Main St., P.O. Box 938 "," McCormick, SC 29835 ",
Ninety Six Chamber of Commerce ,,,(864)543-2900, PO Box 8," Ninety Six, SC 29666 ",
Pageland Chamber of Commerce ,,www.pagelandchamber.com,(843)672-6400, 128 N Pearl St," Pageland, SC 29728 ",
Randy B. Bradley LIC ,,,, 2400 Bee Ridge Rd," Columbia, SC 29223 ",
Saluda County Chamber of Commerce ,,,(864)445-4100, 120 S Main St," Saluda, SC 29138 ",
Tri-County Regional Chamber of Commerce ,,www.tri-crcc.com,(803)496-3831," 8603 Old State Rd., P.O. Box 1012 "," Holly Hill, SC 29059 ",
Westminster Chamber of Commerce ,,westminstersc.com,(864)647-5316," 135 East Main St., P.O. Box 155 "," Westminster, SC 29693 ",
Williamsburg HomeTown Chamber of Commerce ,,www.williamsburgsc.org,(843)355-6431, PO Box 696," Kingstree, SC 29556 ",
