Buffalo Chamber of Commerce ,U.S. Chamber Member,www.buffalowy.com,(307)684-5544, 55 North Main St," Buffalo, WY 82834 ",
Campbell County Chamber of Commerce ,U.S. Chamber Member,www.gillettechamber.com,(307)682-3673, 314 S Gillette Ave," Gillette, WY 82716 ",
Casper Area Chamber of Commerce ,U.S. Chamber Member,www.casperwyoming.org/,(307)234-5311, PO Box 399," Casper, WY 82602 ",
Cody Country Chamber of Commerce ,U.S. Chamber Member,www.codychamber.org,(307)587-2777, 836 Sheridan Ave," Cody, WY 82414 ",
Goshen County Chamber of Commerce ,U.S. Chamber Member,www.goshencountychamber.com,(307)532-3879, 110 West 22nd Ave," Torrington, WY 82240 ",
Greater Cheyenne Chamber of Commerce ,U.S. Chamber Member,www.cheyennechamber.org,(307)638-3388," 121 West 15th St, Suite 204 "," Cheyenne, WY 82001 ",5 / 5
Green River Wyoming Chamber of Commerce ,U.S. Chamber Member,www.grchamber.com,(307)875-5711, 1155 West Flaming Gorge Way," Green River, WY 82935 ",
Lander Chamber of Commerce ,U.S. Chamber Member,www.landerchamber.org,(307)332-3892, 100 N 1st St," Lander, WY 82520 ",
Laramie Chamber Business Alliance ,U.S. Chamber Member,,(307)745-7339, 800 South Third St," Laramie, WY 82070 ",
Riverton Chamber of Commerce ,U.S. Chamber Member,www.rivertonchamber.org,(307)856-4801, 213 W Main St," Riverton, WY 82501 ",
Rock Springs Chamber of Commerce ,U.S. Chamber Member,www.rockspringschamber.com,(307)362-3771, PO Box 398," Rock Springs, WY 82902 ",
Sheridan County Chamber of Commerce ,U.S. Chamber Member,www.sheridanwyomingchamber.org,(307)672-2485, PO Box 707," Sheridan, WY 82801 ",
Thermopolis Chamber of Commerce ,U.S. Chamber Member,thermopolis.com,(877)864-3192, PO Box 768," Thermopolis, WY 82443 ",
Wyoming Chamber of Commerce Partnership ,U.S. Chamber Member,www.wyomingchambers.com,(307)760-3897, PO Box 418," Laramie, WY 82073 ",
Evanston Chamber of Commerce ,,www.etownchamber.com,(847)328-1500," Po Box 365, 1020 Front Street "," Evanston, WY 82931 ",
Platte County Chamber of Commerce ,,www.plattechamber.com,(307)322-2322, 65 16th St," Wheatland, WY 82201 ",
Powell Valley Chamber of Commerce ,,www.powellchamber.org/,(307)754-3494, PO Box 1258," Powell, WY 82435 ",
Rawlins-Carbon County Chamber of Commerce ,,rawlinschamberofcommerce.org,(307)324-4111, PO Box 1331," Rawlins, WY 82301 ",
Star Valley Chamber Of Commerce ,,www.starvalleychamber.com,(307)885-2759, 360 Washington St," Afton, WY 83110 ",
Sublette Chamber of Commerce ,,www.sublettechamber.com,(307)367-2242, PO Box 176," Pinedale, WY 82941 ",
The Enterprise ,,seewahtconversecando.com,(307)358-2000, 130 S 3rd," Douglas, WY 82633 ",
Worland-Ten Sleep Chamber of Commerce ,,www.worlandchamber.com,(307)347-3226, PO Box 1772," Worland, WY 82401 ",
Basin Area Chamber of Commerce ,,www.basincc.com,(307)568-3055, PO Box 883," Basin, WY 82410 ",
Cokeville Chamber of Commerce ,,www.cokevillewy.com,, PO Box 358," Cokeville, WY 83114 ",
Dubois Chamber of Commerce ,,www.duboiswyoming.org,(307)455-2556, 616 W Ramshorn," Dubois, WY 82513 ",
Greater Bridger Valley Chamber of Commerce ,,www.bridgervalleychamber.com,(307)787-6738, PO Box 1506," Lyman, WY 82937 ",
Greybull Area Chamber of Commerce ,,www.greybull.com,(307)765-2100, 521 Greybull Ave.," Greybull, WY 82426 ",
Hulett Chamber of Commerce ,,www.hulett-wyoming.com,(307)467-5747, PO Box 421," Hulett, WY 82720 ",
Kaycee Area Chamberof Commerce ,,,, PO Box 147," Kaycee, WY 82639 ",
Kemmerer/diamondville Area Chamber of Commerce ,,www.kemmererchamber.com,(307)877-9761, 921 Pine Ave," Kemmerer, WY 83101 ",
LaBarge Chamber of Commerce ,,,, PO Box 327," La Barge, WY 83123 ",
Moorcroft Chamber of Commerce ,,,(307)756-3526, PO Box 932," Moorcroft, WY 82721 ",
Newcastle Area Chamber of Commerce ,,newcastle.1wyo.net,(307)746-2739, 1323 Washington Blvd.," Newcastle, WY 82701 ",
Niobrara Chamber ofCommerce ,,www.luskwy.com,(307)334-2950," 224 S Main, #457"," Lusk, WY 82225 ",
Pine Bluffs Area Chamber of Commerce ,,,(307)245-3746, PO Box 563," Pine Bluffs, WY 82082 ",
Saratoga/Platte Valley Chamber of Commerce ,,www.saratogachamber.info,(307)326-8855, 210 West Elm St," Saratoga, WY 82331 ",
Shoshoni Chamber of Commerce ,,,(307)876-2591, PO Box 324," Shoshoni, WY 82649 ",
Sundance Area Chamber of Commerce ,,www.sundancewyoming.com,(307)283-1000, PO Box 1004," Sundance, WY 82729 ",
Wright Area Chamberof Commerce ,,www.fiberpipe.net/~wacc/,(307)464-1312, PO Box 184," Wright, WY 82732 ",
